[
  {
    "uuid": "virtual-ig",
    "title": "Virtual IG",
    "subtitle": "Real-time Interview Platform",
    "description": "Developed a collaborative coding platform for remote technical interviews, featuring a real-time editor. Enabled live, multi-user code editing without screen sharing, improving interview experience for both interviewer and candidate.",
    "tech": ["WebSockets", "Yjs", "Slate.js", "React", "Nest.js", "MongoDB"],
    "type": "personal",
    "featured": true,
    "links": {
      "demo": "https://virtual-ig-ui.vercel.app/#/"
    },
    "previews": [
      "https://images.contentstack.io/v3/assets/blt1e7f8356c41ea09e/blt9101ccebfecdc005/virtual-ig-1?format=webp&height=450&environment=production",
      "https://images.contentstack.io/v3/assets/blt1e7f8356c41ea09e/bltd7fb761cd2dcd79d/virtual-ig.gif?environment=production"
    ]
  },
  {
    "uuid": "offline-detector",
    "title": "Offline Detector",
    "subtitle": "Open Source NPM Package",
    "description": "Built and published an open-source package to provide reliable offline/online detection in browsers, addressing inconsistencies across Chrome, Firefox, and Safari. Designed with a lightweight API and fallback strategies to ensure resilience in real-world network conditions.",
    "tech": ["TypeScript", "Next.js", "Lerna", "Rollup", "npm"],
    "type": "personal",
    "featured": true,
    "links": {
      "demo": "https://hiteshshetty-dev.github.io/offline-detector/",
      "npm": "https://www.npmjs.com/package/offline-detector",
      "github": "https://github.com/hiteshshetty-dev/offline-detector"
    },
    "previews": [
      "https://images.contentstack.io/v3/assets/blt1e7f8356c41ea09e/bltaab19018d66ffed9/offline-ig-1?format=webp&height=450&environment=production",
      "https://images.contentstack.io/v3/assets/blt1e7f8356c41ea09e/blte3b5a057f60a817b/offline-detector.gif?environment=production"
    ]
  },
  {
    "uuid": "visual-editing-platform",
    "title": "Visual Editing Platform",
    "subtitle": "Seamless Content Editing Platform",
    "description": "Led development of the flagship Visual Editing Platform using Module Federation, enabling secure real-time inline editing with iframe sandboxing and postMessage communication, optimized with React Query.",
    "tech": [
      "React",
      "Module Federation",
      "React Query",
      "Zustand",
      "TypeScript"
    ],
    "type": "professional",
    "featured": true,
    "company": "Contentstack",
    "previews": [
      "https://images.contentstack.io/v3/assets/blt1e7f8356c41ea09e/blt9a432f18e3559370/visual-builder-1?format=webp&height=450&environment=production",
      "https://images.contentstack.io/v3/assets/blt1e7f8356c41ea09e/blt4fae2eb6db0a06d6/visual-builder-2?format=webp&environment=production",
      "https://images.contentstack.io/v3/assets/blt1e7f8356c41ea09e/bltfb2f15f99ef07121/visual-builder-3?format=webp&environment=production",
      "https://images.contentstack.io/v3/assets/blt1e7f8356c41ea09e/blt9511f3e2a7d2b067/visual-builder.gif?environment=production"
    ]
  },
  {
    "uuid": "json-rich-text-editor",
    "title": "JSON Rich Text Editor",
    "subtitle": "Advanced Document Editor",
    "description": "Designed and developed a JSON-based Rich Text Editor with advanced features such as drag-and-drop, table support, and seamless copy-paste from Google Docs and MS Word.",
    "tech": ["React", "Slate.js", "React-DND", "Prism.js", "Storybook"],
    "type": "professional",
    "featured": true,
    "company": "Contentstack",
    "previews": [
      "https://images.contentstack.io/v3/assets/blt1e7f8356c41ea09e/bltef37faa695e787f6/json-rte-1?format=webp&height=450&environment=production",
      "https://images.contentstack.io/v3/assets/blt1e7f8356c41ea09e/bltb94921c951d079f4/json-rte-2?format=webp&environment=production",
      "https://images.contentstack.io/v3/assets/blt1e7f8356c41ea09e/blt264e35b54825c716/json-rte-3?format=webp&environment=production",
      "https://images.contentstack.io/v3/assets/blt1e7f8356c41ea09e/blt856bac9033613a12/json-rte?environment=production"
    ]
  },
  {
    "uuid": "ai-assistant",
    "title": "AI Assistant",
    "subtitle": "OpenAI Integration",
    "description": "Led the first AI integration within the CMS, leveraging OpenAI APIs to enable content generation. Designed and hosted a secure backend proxy to handle API key protection, streaming responses, and ensure reliability at scale.",
    "tech": ["OpenAI API", "NestJS", "React", "TypeScript"],
    "type": "professional",
    "featured": false,
    "company": "Contentstack",
    "previews": [
      "https://images.contentstack.io/v3/assets/blt1e7f8356c41ea09e/bltc45949d85a023c74/ai-assistant-1?format=webp&height=450&environment=production",
      "https://images.contentstack.io/v3/assets/blt1e7f8356c41ea09e/blt08395d1512cb07b5/ai-assistant-2?format=webp&environment=production",
      "https://images.contentstack.io/v3/assets/blt1e7f8356c41ea09e/blt573d9d73aa957c0b/ai-assistant.gif?environment=production"
    ]
  }
]
